{
  "id": "foundation-composite",
  "version": "1.0.0",
  "license": "MIT",
  "author": "Lunaris Digital Solutions <info@lunaris.digital>",
  "managedFiles": [
    {
      "source": "templates/readme.md",
      "target": "README.md"
    }
  ],
  "packs": [
    {
      "id": "dotnet-gitignore",
      "version": "1.0.0"
    }
  ]
}
